[
  {
    "id": "albania",
    "iso": {
      "alpha2": "AL",
      "alpha3": "ALB"
    },
    "name": {
      "zh": "阿尔巴尼亚",
      "en": "Albania"
    },
    "region": "southern-europe",
    "coordinates": {
      "latitude": 41.1533,
      "longitude": 20.1683
    },
    "color": "#3b82f6",
    "info": {},
    "status": "draft",
    "metadata": {
      "version": "2.0.0",
      "lastUpdated": "2026-07-06T16:23:08.334Z",
      "createdAt": "2026-07-06T16:23:08.334Z",
      "contributors": [],
      "sources": [
        {
          "name": "World Bank Open Data",
          "type": "official"
        }
      ],
      "dataQuality": {
        "completeness": 15,
        "accuracy": 70,
        "freshness": 80
      },
      "extractionNote": "Auto-generated from standard reference data"
    }
  },
  {
    "id": "argentina",
    "iso": {
      "alpha2": "AR",
      "alpha3": "ARG"
    },
    "name": {
      "zh": "阿根廷",
      "en": "Argentina"
    },
    "region": "south-america",
    "coordinates": {
      "latitude": -38.4161,
      "longitude": -63.6167
    },
    "color": "#3b82f6",
    "info": {},
    "status": "active",
    "metadata": {
      "version": "2.0.0-extracted",
      "lastUpdated": "2026-07-06T15:57:20.317Z",
      "createdAt": "2026-01-01T00:00:00Z",
      "contributors": [],
      "sources": [],
      "dataQuality": {
        "completeness": 20,
        "accuracy": 60,
        "freshness": 50
      },
      "extractionNote": "Auto-extracted from website/countries-data.js v1.2.0"
    }
  },
  {
    "id": "armenia",
    "iso": {
      "alpha2": "AR",
      "alpha3": "ARM"
    },
    "name": {
      "zh": "亚美尼亚",
      "en": "Armenia"
    },
    "region": "middle-east",
    "coordinates": {
      "latitude": 40.1792,
      "longitude": 44.4991
    },
    "color": "#3b82f6",
    "info": {},
    "status": "active",
    "metadata": {
      "version": "2.0.0-extracted",
      "lastUpdated": "2026-07-06T15:57:20.317Z",
      "createdAt": "2026-01-01T00:00:00Z",
      "contributors": [],
      "sources": [],
      "dataQuality": {
        "completeness": 20,
        "accuracy": 60,
        "freshness": 50
      },
      "extractionNote": "Auto-extracted from website/countries-data.js v1.2.0"
    }
  },
  {
    "id": "australia",
    "iso": {
      "alpha2": "AU",
      "alpha3": "AUS"
    },
    "name": {
      "zh": "澳大利亚",
      "en": "Australia"
    },
    "region": "oceania",
    "coordinates": {
      "latitude": -25.2744,
      "longitude": 133.7751
    },
    "color": "#3b82f6",
    "info": {},
    "status": "active",
    "metadata": {
      "version": "2.0.0-extracted",
      "lastUpdated": "2026-07-06T15:57:20.317Z",
      "createdAt": "2026-01-01T00:00:00Z",
      "contributors": [],
      "sources": [],
      "dataQuality": {
        "completeness": 20,
        "accuracy": 60,
        "freshness": 50
      },
      "extractionNote": "Auto-extracted from website/countries-data.js v1.2.0"
    }
  },
  {
    "id": "austria",
    "iso": {
      "alpha2": "AU",
      "alpha3": "AUT"
    },
    "name": {
      "zh": "奥地利",
      "en": "Austria"
    },
    "region": "western-europe",
    "coordinates": {
      "latitude": 47.5162,
      "longitude": 14.5501
    },
    "color": "#3b82f6",
    "info": {},
    "status": "active",
    "metadata": {
      "version": "2.0.0-extracted",
      "lastUpdated": "2026-07-06T15:57:20.317Z",
      "createdAt": "2026-01-01T00:00:00Z",
      "contributors": [],
      "sources": [],
      "dataQuality": {
        "completeness": 20,
        "accuracy": 60,
        "freshness": 50
      },
      "extractionNote": "Auto-extracted from website/countries-data.js v1.2.0"
    }
  },
  {
    "id": "azerbaijan",
    "iso": {
      "alpha2": "AZ",
      "alpha3": "AZE"
    },
    "name": {
      "zh": "阿塞拜疆",
      "en": "Azerbaijan"
    },
    "region": "middle-east",
    "coordinates": {
      "latitude": 40.4093,
      "longitude": 49.8671
    },
    "color": "#3b82f6",
    "info": {},
    "status": "active",
    "metadata": {
      "version": "2.0.0-extracted",
      "lastUpdated": "2026-07-06T15:57:20.317Z",
      "createdAt": "2026-01-01T00:00:00Z",
      "contributors": [],
      "sources": [],
      "dataQuality": {
        "completeness": 20,
        "accuracy": 60,
        "freshness": 50
      },
      "extractionNote": "Auto-extracted from website/countries-data.js v1.2.0"
    }
  },
  {
    "id": "bahrain",
    "iso": {
      "alpha2": "BH",
      "alpha3": "BHR"
    },
    "name": {
      "zh": "巴林",
      "en": "Bahrain"
    },
    "region": "middle-east",
    "coordinates": {
      "latitude": 25.9304,
      "longitude": 50.6378
    },
    "color": "#3b82f6",
    "info": {},
    "status": "draft",
    "metadata": {
      "version": "2.0.0",
      "lastUpdated": "2026-07-06T16:22:19.886Z",
      "createdAt": "2026-07-06T16:22:19.886Z",
      "contributors": [],
      "sources": [
        {
          "name": "World Bank Open Data",
          "type": "official"
        }
      ],
      "dataQuality": {
        "completeness": 15,
        "accuracy": 70,
        "freshness": 80
      },
      "extractionNote": "Auto-generated from standard reference data"
    }
  },
  {
    "id": "bangladesh",
    "iso": {
      "alpha2": "BD",
      "alpha3": "BGD"
    },
    "name": {
      "zh": "孟加拉国",
      "en": "Bangladesh"
    },
    "region": "south-asia",
    "coordinates": {
      "latitude": 23.685,
      "longitude": 90.3563
    },
    "color": "#3b82f6",
    "info": {},
    "status": "draft",
    "metadata": {
      "version": "2.0.0",
      "lastUpdated": "2026-07-06T16:22:19.886Z",
      "createdAt": "2026-07-06T16:22:19.886Z",
      "contributors": [],
      "sources": [
        {
          "name": "World Bank Open Data",
          "type": "official"
        }
      ],
      "dataQuality": {
        "completeness": 15,
        "accuracy": 70,
        "freshness": 80
      },
      "extractionNote": "Auto-generated from standard reference data"
    }
  },
  {
    "id": "belgium",
    "iso": {
      "alpha2": "BE",
      "alpha3": "BEL"
    },
    "name": {
      "zh": "比利时",
      "en": "Belgium"
    },
    "region": "western-europe",
    "coordinates": {
      "latitude": 50.5039,
      "longitude": 4.4699
    },
    "color": "#3b82f6",
    "info": {},
    "status": "draft",
    "metadata": {
      "version": "2.0.0",
      "lastUpdated": "2026-07-06T16:22:19.886Z",
      "createdAt": "2026-07-06T16:22:19.886Z",
      "contributors": [],
      "sources": [
        {
          "name": "World Bank Open Data",
          "type": "official"
        }
      ],
      "dataQuality": {
        "completeness": 15,
        "accuracy": 70,
        "freshness": 80
      },
      "extractionNote": "Auto-generated from standard reference data"
    }
  },
  {
    "id": "brazil",
    "iso": {
      "alpha2": "BR",
      "alpha3": "BRA"
    },
    "name": {
      "zh": "巴西",
      "en": "Brazil"
    },
    "region": "south-america",
    "coordinates": {
      "latitude": -14.235,
      "longitude": -51.9253
    },
    "color": "#3b82f6",
    "info": {},
    "status": "active",
    "metadata": {
      "version": "2.0.0-extracted",
      "lastUpdated": "2026-07-06T15:57:20.317Z",
      "createdAt": "2026-01-01T00:00:00Z",
      "contributors": [],
      "sources": [],
      "dataQuality": {
        "completeness": 20,
        "accuracy": 60,
        "freshness": 50
      },
      "extractionNote": "Auto-extracted from website/countries-data.js v1.2.0"
    }
  },
  {
    "id": "brunei",
    "iso": {
      "alpha2": "BN",
      "alpha3": "BRN"
    },
    "name": {
      "zh": "文莱",
      "en": "Brunei"
    },
    "region": "southeast-asia",
    "coordinates": {
      "latitude": 4.5353,
      "longitude": 114.7277
    },
    "color": "#3b82f6",
    "info": {},
    "status": "draft",
    "metadata": {
      "version": "2.0.0",
      "lastUpdated": "2026-07-06T16:22:19.886Z",
      "createdAt": "2026-07-06T16:22:19.886Z",
      "contributors": [],
      "sources": [
        {
          "name": "World Bank Open Data",
          "type": "official"
        }
      ],
      "dataQuality": {
        "completeness": 15,
        "accuracy": 70,
        "freshness": 80
      },
      "extractionNote": "Auto-generated from standard reference data"
    }
  },
  {
    "id": "bulgaria",
    "iso": {
      "alpha2": "BG",
      "alpha3": "BGR"
    },
    "name": {
      "zh": "保加利亚",
      "en": "Bulgaria"
    },
    "region": "eastern-europe",
    "coordinates": {
      "latitude": 42.6977,
      "longitude": 23.3219
    },
    "color": "#3b82f6",
    "info": {},
    "status": "active",
    "metadata": {
      "version": "2.0.0-extracted",
      "lastUpdated": "2026-07-06T15:57:20.317Z",
      "createdAt": "2026-01-01T00:00:00Z",
      "contributors": [],
      "sources": [],
      "dataQuality": {
        "completeness": 20,
        "accuracy": 60,
        "freshness": 50
      },
      "extractionNote": "Auto-extracted from website/countries-data.js v1.2.0"
    }
  },
  {
    "id": "cambodia",
    "iso": {
      "alpha2": "KH",
      "alpha3": "KHM"
    },
    "name": {
      "zh": "柬埔寨",
      "en": "Cambodia"
    },
    "region": "southeast-asia",
    "coordinates": {
      "latitude": 12.5657,
      "longitude": 104.991
    },
    "color": "#3b82f6",
    "info": {},
    "status": "draft",
    "metadata": {
      "version": "2.0.0",
      "lastUpdated": "2026-07-06T16:22:19.886Z",
      "createdAt": "2026-07-06T16:22:19.886Z",
      "contributors": [],
      "sources": [
        {
          "name": "World Bank Open Data",
          "type": "official"
        }
      ],
      "dataQuality": {
        "completeness": 15,
        "accuracy": 70,
        "freshness": 80
      },
      "extractionNote": "Auto-generated from standard reference data"
    }
  },
  {
    "id": "canada",
    "iso": {
      "alpha2": "CA",
      "alpha3": "CAN"
    },
    "name": {
      "zh": "加拿大",